{
  "issue_id": "weforge-001",
  "selected": [
    {
      "candidate_id": "weforge-001-c1",
      "angle": "The founding fact of the chronicle: what launched, when, and on whose record.",
      "prominence": "lead"
    },
    {
      "candidate_id": "weforge-001-c2",
      "angle": "How operational habit hardened into the platform's intake path — reported with its evidentiary limits visible.",
      "prominence": "feature"
    },
    {
      "candidate_id": "weforge-001-c3",
      "angle": "The chronicle's first archive-gap story: the platform survived an outage its own record cannot explain.",
      "prominence": "feature"
    }
  ],
  "omitted": [
    {
      "candidate_id": "weforge-001-c4",
      "reason": "The CI-growth story needs usage data the current corpus does not contain; running it now would force unsupported quantitative claims.",
      "disposition": "deferred",
      "thread_id": "weforge-ci-growth"
    }
  ],
  "coverage_rationale": "One firm founding story, one qualified institutional story, and one archive-gap story give the first issue an honest cross-section: what the record establishes, what it only suggests, and what it has already lost. The CI story defers until usage data exists."
}
